{
  "$schema": "http://json-schema.org/draft-07/schema#",
  "$id": "https://opencrawling.org/schemas/ois-document-schema.json",
  "$comment": "Copyright © 2026 the original author or authors (piergiorgio@apache.org). Licensed under the Apache License, Version 2.0 (the 'License'); you may not use this file except in compliance with the License. You may obtain a copy of the License at http://www.apache.org/licenses/LICENSE-2.0. Unless required by applicable law or agreed to in writing, software distributed under the License is distributed on an 'AS IS' BASIS, WITHOUT WARRANTIES OR CONDITIONS OF ANY KIND, either express or implied. See the License for the specific language governing permissions and limitations under the License.",
  "title": "OIS Document Payload Schema",
  "description": "Standard schema for exchanging data and security permissions of enterprise files.",
  "type": "object",
  "required": [
    "id",
    "source",
    "content",
    "metadata",
    "security"
  ],
  "properties": {
    "id": {
      "type": "string",
      "description": "Unique identifier of the document in the target index."
    },
    "source": {
      "type": "object",
      "required": [
        "type",
        "instance"
      ],
      "properties": {
        "type": {
          "type": "string",
          "description": "Repository type (e.g. sharepoint, s3, database, filesystem)."
        },
        "instance": {
          "type": "string",
          "format": "uri-reference",
          "description": "Base URI of the scanned repository instance."
        },
        "connectorVersion": {
          "type": "string",
          "description": "Version of the repository connector used."
        }
      }
    },
    "content": {
      "type": "object",
      "required": [
        "mimeType"
      ],
      "properties": {
        "mimeType": {
          "type": "string",
          "description": "RFC 2046 media type of the document."
        },
        "text": {
          "type": "string",
          "description": "Extracted text content from the document (utf-8)."
        },
        "claimCheckUri": {
          "type": "string",
          "format": "uri-reference",
          "description": "URI reference pointing to the raw binary file in shared storage."
        }
      }
    },
    "metadata": {
      "type": "object",
      "description": "Arbitrary key-value metadata map extracted from the source file.",
      "properties": {
        "title": { "type": "string" },
        "author": { "type": "string" },
        "lastModified": { "type": "string", "format": "date-time" }
      },
      "additionalProperties": true
    },
    "security": {
      "type": "object",
      "required": [
        "inheritanceEnabled",
        "permissions"
      ],
      "properties": {
        "inheritanceEnabled": {
          "type": "boolean",
          "description": "Indicates whether the document inherits ACL settings from its folder structure."
        },
        "permissions": {
          "type": "array",
          "items": {
            "type": "object",
            "required": [
              "identity",
              "identityType",
              "access"
            ],
            "properties": {
              "identity": {
                "type": "string",
                "description": "Unique identifier of the user or group (e.g. Active Directory SID or email)."
              },
              "identityType": {
                "type": "string",
                "enum": [
                  "windows-sid",
                  "oauth-group",
                  "user-principal-name",
                  "local-role",
                  "public"
                ],
                "description": "Authentication namespace/type of the identity."
              },
              "displayName": {
                "type": "string",
                "description": "Human-readable label for debugging audit logs."
              },
              "access": {
                "type": "string",
                "enum": [
                  "read",
                  "write",
                  "deny"
                ],
                "description": "Permission rule matching the security constraint."
              }
            }
          }
        }
      }
    }
  }
}
